key,title,description,estimated-cost,acceptance-criteria,priority,link,key:manager
user-story-01,Enhancing User Experience with Personalized Dashboards,"Customize your dashboard for a tailored experience in the web, improve the UX of the app experiences",100,User can select widgets; settings saved & applied instantly across devices independently of OS used.,MUST,http://www.example.org,manager-01
user-story-02,Streamlining Checkout for Faster Online Purchases by implementing UI system,"Quick, easy checkout for hassle-free shopping.",50,"Checkout <4 clicks, <2 sec load, autofill, clear cost, multiple payments, instant email confirmation",SHOULD,http://www.example.org,manager-01
user-story-03,Mobile App Notifications to Keep Users Informed,Stay updated with instant app notifications.,50,Criteria to be defined,COULD,http://www.example.org,manager-01
user-story-04,貸んい建濯よ芝弾テソ,Create a unique profile that reflects you.,33,Criteria to be defined,WONT,http://www.thisisaverylongexampleurlthatdoesnotactuallyleadanywherespecificallydesignedtobeexactlytwohundredandfiftyfivecharacterslongincludingthehttpwwwparttoseehowitlooksandfeelsinpracticeabcdefg1234567890abcdefghijklmnopqrstuvwxyzletsgetto255chars.html,manager-01
user-story-05,Advanced Search Filters for Efficient Navigation,Find what you need faster with smart filters.,33,貸んい建濯よ芝弾テソ,MUST,null,manager-01
user-story-06,-,Track your finance,33,Criteria to be defined,SHOULD,http://www.козаоза.org,manager-01
user-story-07,Interactive Tutorials for New Users,Learn the ropes with interactive guides,80,Criteria to be defined,MUST,null,manager-01
user-story-08,Real-Time Collaboration Tools for Teams,"Collaborate in real time, anywhere.",1,-,MUST,null,manager-01
user-story-09,Feedback System for Continuous Improvement,Share your thoughts for app enhancements,10,Criteria to be defined,MUST,http://www.example.org,manager-01
user-story-10,Accessibility Features for All Users,Making technology accessible to everyone.,50,Criteria to be defined,MUST,null,manager-02
user-story-11,Seamless Cross-Platform Synchronization for Users,Simplifying navigation with intuitive design updates.,49,Criteria to be defined,SHOULD,http://www.example.org,manager-02
user-story-12,Dynamic Content Recommendation Engine,Command your app without lifting a finger,1,Criteria to be defined,COULD,null,manager-02
user-story-13,Effortless File Sharing and Management System,Keep your devices in sync effortlessly.,2,Criteria to be defined,MUST,http://www.example.org,manager-02
user-story-14,Revolutionizing Customer Support with AI Chatbots,Get instant answers from our smart AI support,98,коза коза,WONT,null,manager-02
user-story-15,коза коза,-,999,Criteria to be defined,MUST,http://www.acme.org/moreInfo,manager-02
user-story-16,Eco-Friendly Options for Sustainable User Choices,Choose sustainable options for a greener future.,745,Criteria to be defined,MUST,null,manager-02
user-story-17,Secure Login with Two-Factor Authentication,коза коза,100,Criteria to be defined,SHOULD,http://建濯よ.com,manager-02
user-story-18,Event Planning Made Simple with Smart Tools,貸んい建濯よ芝弾テソ,50,Criteria to be defined,MUST,http://www.example.org,manager-02
